{
  "schema_version": "contextdb.version-manifest/v1",
  "product_version": "0.1.0-alpha.1",
  "release_channel": "development",
  "source": {
    "git_commit": "0000000000000000000000000000000000000000",
    "dirty": true,
    "repository": "https://github.com/mikhailbovt/ContextDB",
    "rfc_revision": "RFC-0001-v0.3",
    "errata": ["ERRATA-0001"],
    "adrs": ["ADR-0001", "ADR-0002", "ADR-0003", "ADR-0004", "ADR-0005", "ADR-0006"]
  },
  "build": {
    "timestamp": "2026-08-12T09:09:59.251Z",
    "rustc": "rustc 1.97.1 (8bab26f4f 2026-07-14)",
    "cargo": "cargo 1.97.1 (c980f4866 2026-06-30)",
    "target": "x86_64-pc-windows-msvc",
    "profile": "release",
    "reproducible": false,
    "builder": "local-m6-hierarchy-ablation"
  },
  "formats": {
    "logical_record": {"writer": 1, "read_min": 1, "read_max": 1, "required_features": []},
    "hierarchy_generation": {"writer": 1, "read_min": 1, "read_max": 1, "required_features": ["versioned-hierarchy"]}
  },
  "feature_profile": "research",
  "features": ["versioned-hierarchy", "immutable-adjacency", "policy-partitioned-beam"],
  "storage_backend": {
    "name": "in-memory-hierarchy-fixture",
    "version": "contextdb-hierarchy-v1"
  }
}
